{
  "entry": "./src/particles.ts",
  "stamp": true,
  "fps": 30,
  "duration": 6,
  "width": 1280,
  "height": 720,
  "seed": 7,
  "sequential": true,
  "params": {
    "type": "object",
    "properties": {
      "count": { "type": "integer", "minimum": 1024, "maximum": 262144, "default": 65536 },
      "trail": { "type": "number", "minimum": 0, "maximum": 0.99, "default": 0.92 }
    }
  }
}
