{
  "entry": "./src/composition.ts",
  "fps": 10,
  "duration": 1,
  "width": 8,
  "height": 8,
  "params": {
    "type": "object",
    "properties": { "peek": { "type": "string", "default": "" } }
  },
  "bakes": {
    "glow": {
      "command": "node tools/make.mjs",
      "inputs": ["tools/make.mjs", "level.txt"],
      "dir": "../glow",
      "frames": "glow.###.bin"
    }
  }
}
